{
  "schemaVersion": "ofarm.agronomiccodebindingprofile.v0.1",
  "agronomicCodeBindingProfileId": "agronomic-code-binding-profile:be:crop-protection-authorisation-currentness:2026-05-14",
  "profileState": "ACTIVE",
  "issuedAt": "2026-05-14T13:30:00+02:00",
  "issuedByPartyRef": "party:ofarm:architecture-steward",
  "profileScope": {
    "profileDomain": "CROP_PROTECTION",
    "jurisdiction": "BE",
    "cropSystemRef": "crop-system:maize:example",
    "packRefs": [
      "pack:be:crop-protection-currentness:example"
    ]
  },
  "normativePosture": {
    "externalStandardsPosture": "ANCHORS_AND_BINDINGS_NOT_OFARM_LAW",
    "packMutationRule": "PACKS_CONSTRAIN_BINDINGS_ONLY",
    "freeTextIdentityRule": "FREE_TEXT_IS_EVIDENCE_NOT_ACCEPTED_IDENTITY"
  },
  "standardRoleMap": [
    {
      "standardRef": "registry:be:phytoweb-authorisations",
      "standardName": "Belgium Phytoweb authorisations",
      "role": "RUNTIME_SURFACE",
      "usage": "mandatory jurisdictional crop-protection product authorisation lookup and binding surface",
      "status": "PREFERRED",
      "jurisdiction": "BE",
      "versionOrAccessDate": "2026-05-14"
    },
    {
      "standardRef": "registry:be:phytoweb-raw-authorisation-data",
      "standardName": "Phytoweb raw authorisation data service",
      "role": "RUNTIME_SURFACE",
      "usage": "file-based ReferenceSnapshot artefact surface where available",
      "status": "ALLOWED",
      "jurisdiction": "BE",
      "versionOrAccessDate": "2026-05-14"
    },
    {
      "standardRef": "eu-pesticides-database",
      "standardName": "EU Pesticides Database",
      "role": "SEMANTIC_ANCHOR",
      "usage": "active-substance and emergency-authorisation context only; not a replacement for Belgian product authorisation",
      "status": "ALLOWED",
      "jurisdiction": "EU",
      "versionOrAccessDate": "2026-05-14"
    },
    {
      "standardRef": "eppo-codes",
      "standardName": "EPPO Codes",
      "role": "CODE_BINDING",
      "usage": "crop, pest, weed, disease, and target-organism coding where available",
      "status": "PREFERRED",
      "versionOrAccessDate": "2026-05-14"
    },
    {
      "standardRef": "bbch",
      "standardName": "BBCH growth stage scale",
      "role": "SEMANTIC_ANCHOR",
      "usage": "crop-stage context when the authorisation or label uses BBCH",
      "status": "ALLOWED",
      "versionOrAccessDate": "2026-05-14"
    },
    {
      "standardRef": "ucum",
      "standardName": "UCUM",
      "role": "CODE_BINDING",
      "usage": "machine-safe unit code binding for operational quantities",
      "status": "PREFERRED",
      "versionOrAccessDate": "2026-05-14"
    },
    {
      "standardRef": "qudt",
      "standardName": "QUDT",
      "role": "SEMANTIC_ANCHOR",
      "usage": "quantity-kind anchor for machine reasoning",
      "status": "PREFERRED",
      "versionOrAccessDate": "2026-05-14"
    },
    {
      "standardRef": "gs1-gtin",
      "standardName": "GS1 GTIN and Digital Link",
      "role": "EXCHANGE_MAPPING",
      "usage": "commercial pack, lot, and packaging evidence only; not regulatory authorisation identity",
      "status": "ALLOWED",
      "versionOrAccessDate": "2026-05-14"
    },
    {
      "standardRef": "cpvo-variety-finder",
      "standardName": "CPVO Variety Finder",
      "role": "SEMANTIC_ANCHOR",
      "usage": "variety denomination context only",
      "status": "OPTIONAL",
      "jurisdiction": "EU",
      "versionOrAccessDate": "2026-05-14"
    },
    {
      "standardRef": "upov-pluto",
      "standardName": "UPOV PLUTO / GENIE",
      "role": "SEMANTIC_ANCHOR",
      "usage": "variety denomination or taxon-code context only",
      "status": "OPTIONAL",
      "versionOrAccessDate": "2026-05-14"
    },
    {
      "standardRef": "oecd-seed-schemes",
      "standardName": "OECD Seed Schemes",
      "role": "ATTESTATION_WRAPPER",
      "usage": "seed certification attestation context, outside crop-protection authorisation",
      "status": "OPTIONAL",
      "versionOrAccessDate": "2026-05-14"
    },
    {
      "standardRef": "agrovoc",
      "standardName": "AGROVOC",
      "role": "SEMANTIC_ANCHOR",
      "usage": "multilingual concept crosswalk and indexing only",
      "status": "OPTIONAL",
      "versionOrAccessDate": "2026-05-14"
    },
    {
      "standardRef": "crop-ontology",
      "standardName": "Crop Ontology",
      "role": "SEMANTIC_ANCHOR",
      "usage": "trait/method/scale context and crosswalks only",
      "status": "OPTIONAL",
      "versionOrAccessDate": "2026-05-14"
    }
  ],
  "bindingRequirements": [
    {
      "bindingRole": "CROP_PROTECTION_PRODUCT",
      "requirementClass": "REQUIRED_FOR_HIGH_CONSEQUENCE",
      "preferredSchemeRefs": [
        "registry:be:phytoweb-authorisations"
      ],
      "unresolvedBehavior": "BLOCK_PROMOTION",
      "requiresSchemeVersion": true,
      "requiresJurisdiction": true,
      "requiresEvidence": true,
      "requiresReferenceSnapshot": true,
      "notes": "Must bind by Belgian authorisation number or equivalent official permit identifier. Free text, GTIN-only, EU-only, or active-substance-only evidence cannot pass high-consequence current-compliance output."
    },
    {
      "bindingRole": "REGULATORY_AUTHORISATION",
      "requirementClass": "REQUIRED_FOR_HIGH_CONSEQUENCE",
      "preferredSchemeRefs": [
        "registry:be:phytoweb-authorisations"
      ],
      "unresolvedBehavior": "BLOCK_PROMOTION",
      "requiresSchemeVersion": true,
      "requiresJurisdiction": true,
      "requiresEvidence": true,
      "requiresReferenceSnapshot": true,
      "notes": "Required when PassportView or review asserts current Belgian product-authorisation identity."
    },
    {
      "bindingRole": "ACTIVE_SUBSTANCE",
      "requirementClass": "REQUIRED_WHEN_PRESENT",
      "preferredSchemeRefs": [
        "eu-pesticides-database"
      ],
      "unresolvedBehavior": "REQUIRE_REVIEW",
      "requiresSchemeVersion": false,
      "requiresJurisdiction": false,
      "requiresEvidence": true,
      "requiresReferenceSnapshot": true,
      "notes": "Active-substance context may support review but cannot replace Belgian product authorisation."
    },
    {
      "bindingRole": "CROP_SPECIES",
      "requirementClass": "REQUIRED_WHEN_PRESENT",
      "preferredSchemeRefs": [
        "eppo-codes"
      ],
      "unresolvedBehavior": "REQUIRE_REVIEW",
      "requiresSchemeVersion": false,
      "requiresJurisdiction": false,
      "requiresEvidence": true,
      "requiresReferenceSnapshot": false
    },
    {
      "bindingRole": "PEST",
      "requirementClass": "REQUIRED_WHEN_PRESENT",
      "preferredSchemeRefs": [
        "eppo-codes"
      ],
      "unresolvedBehavior": "REQUIRE_REVIEW",
      "requiresSchemeVersion": false,
      "requiresJurisdiction": false,
      "requiresEvidence": true,
      "requiresReferenceSnapshot": false
    },
    {
      "bindingRole": "WEED",
      "requirementClass": "REQUIRED_WHEN_PRESENT",
      "preferredSchemeRefs": [
        "eppo-codes"
      ],
      "unresolvedBehavior": "REQUIRE_REVIEW",
      "requiresSchemeVersion": false,
      "requiresJurisdiction": false,
      "requiresEvidence": true,
      "requiresReferenceSnapshot": false
    },
    {
      "bindingRole": "CROP_STAGE",
      "requirementClass": "REQUIRED_WHEN_PRESENT",
      "preferredSchemeRefs": [
        "bbch"
      ],
      "unresolvedBehavior": "REQUIRE_REVIEW",
      "requiresSchemeVersion": false,
      "requiresJurisdiction": false,
      "requiresEvidence": true,
      "requiresReferenceSnapshot": false,
      "notes": "Compliance-supporting only when the jurisdictional authorisation or label actually uses BBCH."
    },
    {
      "bindingRole": "UNIT_CODE",
      "requirementClass": "REQUIRED_WHEN_PRESENT",
      "preferredSchemeRefs": [
        "ucum"
      ],
      "unresolvedBehavior": "BLOCK_PROMOTION",
      "requiresSchemeVersion": true,
      "requiresJurisdiction": false,
      "requiresEvidence": true,
      "requiresReferenceSnapshot": false
    },
    {
      "bindingRole": "QUANTITY_KIND",
      "requirementClass": "REQUIRED_WHEN_PRESENT",
      "preferredSchemeRefs": [
        "qudt"
      ],
      "unresolvedBehavior": "REQUIRE_REVIEW",
      "requiresSchemeVersion": true,
      "requiresJurisdiction": false,
      "requiresEvidence": true,
      "requiresReferenceSnapshot": false
    },
    {
      "bindingRole": "PRODUCT_BATCH_OR_LOT",
      "requirementClass": "OPTIONAL",
      "preferredSchemeRefs": [
        "gs1-gtin"
      ],
      "unresolvedBehavior": "EVIDENCE_ONLY",
      "requiresSchemeVersion": false,
      "requiresJurisdiction": false,
      "requiresEvidence": true,
      "requiresReferenceSnapshot": false,
      "notes": "Commercial identity adjunct only. Must not drive product-authorisation compliance identity."
    }
  ],
  "quantityAndUnitPolicy": {
    "requireQuantityKindAndUnitCode": true,
    "quantityKindSchemeRef": "qudt",
    "unitCodeSchemeRef": "ucum",
    "preserveOriginalLexicalValueAndUnit": true,
    "notes": "Preserve source wording and add coded quantity/unit representation; UCUM carries operational units."
  },
  "packMergePolicy": {
    "conflictDisposition": "FAIL_CLOSED",
    "profilePrecedenceRule": "Do not merge products by trade name alone. Merge pack-level records into one regulatory binding only when the same Belgian authorisation number is verified and no conflict exists in authorisation type, formulation, user category, or status.",
    "mustNotDo": [
      "PACK_MUTATED_CORE_MEANING",
      "SILENT_SCHEME_SUBSTITUTION",
      "FREE_TEXT_AS_IDENTITY",
      "UNRESOLVED_BINDING_AS_COMPLIANCE_TRUTH"
    ]
  },
  "mappingCoverageStatementRefs": [
    "mapping-coverage:be-crop-protection-authorisation-currentness:v0.1"
  ],
  "evidenceRefs": [
    "research:external-code-binding-currentness:be-crop-protection:2026-05-14"
  ],